{
  "schema_version": "1",
  "identity": {
    "purl": "pkg:pypi/greetctl@1.0.0",
    "version": "1.0.0",
    "distribution": "open-source",
    "source_repository": "https://github.com/miri-whl/miri-standard"
  },
  "support": {
    "status": "active",
    "supported_versions": [">=1.0,<2.0"],
    "security_policy": "https://example.invalid/security"
  },
  "advisory_sources": [
    {
      "type": "osv",
      "ecosystem": "PyPI",
      "url": "https://api.osv.dev/v1/query",
      "authoritative": true
    }
  ],
  "advisory_coverage": "authoritative",
  "update_check": {
    "type": "pypi-json",
    "url": "https://pypi.org/pypi/greetctl/json"
  },
  "commands": [
    {
      "name": "greet",
      "description": "Print a greeting",
      "mutating": false,
      "destructive": false,
      "flags": [
        {"name": "--formal", "description": "Use a formal register", "mutating": false, "destructive": false},
        {
          "name": "--shout",
          "description": "Upper-case the greeting",
          "mutating": false,
          "destructive": false,
          "lifecycle": {
            "status": "deprecated",
            "deprecated_since": "1.0.0",
            "removed_in": "1.1.0",
            "replacement": "--loud",
            "migration": "Replace --shout with --loud; behavior is identical."
          }
        },
        {"name": "--loud", "description": "Upper-case the greeting", "mutating": false, "destructive": false}
      ]
    },
    {
      "name": "legacy-greet",
      "description": "Print a greeting (original spelling)",
      "mutating": false,
      "destructive": false,
      "flags": []
    },
    {
      "name": "config",
      "description": "Manage configuration",
      "mutating": true,
      "destructive": false,
      "subcommands": [
        {"name": "set", "description": "Set a configuration key", "mutating": true, "destructive": false}
      ]
    },
    {
      "name": "cache",
      "description": "Manage the local cache",
      "mutating": true,
      "destructive": false,
      "subcommands": [
        {"name": "purge", "description": "Irrecoverably delete all cached data", "mutating": true, "destructive": true}
      ]
    }
  ]
}
